{
    "skillID": "SK001",
    "skillName": "Engine Repair",
    "skillDifficulty": "Advanced",
    "description": "This skill involves diagnosing and repairing engine issues in vehicles.",
    "requiredTool": [
        "Wrench Set",
        "Socket Set",
        "OBD-II Scanner",
        "Jack and Jack Stands"
    ]
}